{
  "version": "0.1",
  "generated_at": "2026-02-04T05:36:49.546501Z",
  "nodes": [
    {
      "id": "Q000001",
      "title": "Non-Cessation and Chaos/Order Question",
      "domains": [
        "philosophy"
      ],
      "summary": "Introduces non-cessation and the chaos/order problem.",
      "status": "open",
      "leak_profile": {
        "L1": 0.3,
        "L2": 0.3,
        "L3": 0.2,
        "L4": 0.4,
        "L5": 0.6,
        "L6": 0.3
      },
      "chart_tags": [
        "metaphysical",
        "narrative",
        "ontology",
        "cognition"
      ],
      "claim_temptations": [
        "I"
      ],
      "invariants": [
        {
          "id": "I-001-001",
          "name": "Non-cessation recurrence",
          "definition": "If non-cessation is assumed, then recurrence-through-differentiation must remain invariant under re-description; otherwise the claim collapses. (regime_marker)",
          "role": "regime_marker"
        }
      ],
      "discriminators": [
        {
          "id": "D-IOB-001",
          "name": "Order/chaos split probe",
          "pattern": "ensemble_split",
          "how_to": "Observable: narrative closure versus regress when order/chaos accounts are recursively restated. Split criterion: keep when recurrence yields stable closure without forcing an ultimate substrate; reject when explanation enters uncontrolled regress.",
          "transferable": true
        }
      ],
      "sources": [
        "P0148"
      ]
    },
    {
      "id": "Q000002",
      "title": "Formalization Request and Logic Background",
      "domains": [
        "logic",
        "epistemology"
      ],
      "summary": "Requests rigor and notes logic training.",
      "status": "open",
      "leak_profile": {
        "L1": 0.2,
        "L2": 0.2,
        "L3": 0.2,
        "L4": 0.3,
        "L5": 0.7,
        "L6": 0.5
      },
      "chart_tags": [
        "method",
        "logic",
        "epistemology",
        "computation"
      ],
      "claim_temptations": [
        "I"
      ],
      "invariants": [
        {
          "id": "I-002-001",
          "name": "Chart stability",
          "definition": "Commitments remain intact across formal and narrative restatements. (budget)",
          "role": "regime_marker"
        }
      ],
      "discriminators": [
        {
          "id": "D-CI-001",
          "name": "Formalization boundary test",
          "pattern": "orthogonal_probe",
          "how_to": "Observable: primitive budget / silent premise count after formal restatement. Split criterion: pass only when formalization preserves entailments without increasing primitive count; fail when any new primitive or hidden axiom is required to recover the claim.",
          "transferable": true
        }
      ],
      "sources": [
        "P0228"
      ],
      "interface_variables": [
        "ledger stability / taxonomy drift",
        "primitive budget / silent premise"
      ]
    },
    {
      "id": "Q000003",
      "title": "Question on Wilson Loops",
      "domains": [
        "physics"
      ],
      "summary": "Asks for conceptual interpretation of Wilson loops.",
      "status": "open",
      "leak_profile": {
        "L1": 0.4,
        "L2": 0.3,
        "L3": 0.6,
        "L4": 0.5,
        "L5": 0.2,
        "L6": 0.2
      },
      "chart_tags": [
        "physics",
        "measurement",
        "constraint",
        "computation"
      ],
      "claim_temptations": [
        "I"
      ],
      "invariants": [
        {
          "id": "I-003-001",
          "name": "Loop residue",
          "definition": "Closed-loop comparison yields a stable residual under gauge re-description. (discriminator)",
          "role": "regime_marker"
        }
      ],
      "discriminators": [
        {
          "id": "D-PHY-001",
          "name": "Loop residue test",
          "pattern": "interface_scatter",
          "how_to": "Observable: loop/closure residue after local gauge rewrites. Split criterion: keep when closed-loop residue remains measurable; reject when signal is removable by local chart choice. Orthogonality note: this test targets closure-stable residue magnitude, not operator-class admissibility or unit-scaling behavior.",
          "transferable": true
        }
      ],
      "sources": [
        "P0280"
      ],
      "interface_variables": [
        "dimensionless drift",
        "observability equivalence class",
        "orientation residue"
      ]
    },
    {
      "id": "Q000004",
      "title": "Question About Physical Rules",
      "domains": [
        "philosophy"
      ],
      "summary": "Frames laws as emergent from inversion history.",
      "status": "open",
      "leak_profile": {
        "L1": 0.3,
        "L2": 0.3,
        "L3": 0.2,
        "L4": 0.4,
        "L5": 0.6,
        "L6": 0.3
      },
      "chart_tags": [
        "metaphysical",
        "narrative",
        "ontology",
        "cognition"
      ],
      "claim_temptations": [
        "I"
      ],
      "invariants": [
        {
          "id": "I-004-001",
          "name": "Rule survival under inversion",
          "definition": "If rule-formation-through-inversion is assumed, then survivor-structure must remain invariant under re-description; otherwise the claim collapses. (regime_marker)",
          "role": "regime_marker"
        }
      ],
      "discriminators": [
        {
          "id": "D-IOB-002",
          "name": "Rule survivor split",
          "pattern": "ensemble_split",
          "how_to": "Observable: dependency chain of rule-survivors across inversion cycles. Split criterion: keep when survivor rules remain derivable from prior distinctions; reject when inversion forces discontinuous rule resets.",
          "transferable": true
        }
      ],
      "sources": [
        "P0284"
      ]
    },
    {
      "id": "Q000005",
      "title": "Gravity as the First Force?",
      "domains": [
        "physics"
      ],
      "summary": "Raises gravity\u2019s primacy and weakness.",
      "status": "open",
      "leak_profile": {
        "L1": 0.4,
        "L2": 0.3,
        "L3": 0.6,
        "L4": 0.5,
        "L5": 0.2,
        "L6": 0.2
      },
      "chart_tags": [
        "physics",
        "measurement",
        "constraint",
        "computation"
      ],
      "claim_temptations": [
        "I"
      ],
      "invariants": [
        {
          "id": "I-005-001",
          "name": "Constraint primacy",
          "definition": "Geometric constraints remain primary across force/geometry framing shifts. (regime_marker)",
          "role": "regime_marker"
        }
      ],
      "discriminators": [
        {
          "id": "D-PHY-002",
          "name": "Geometry\u2013force probe",
          "pattern": "orthogonal_probe",
          "how_to": "Observable: constraint consistency in geometry-first vs force-first framing. Split criterion: keep when constraints close without external stage assumptions; reject when force framing requires extra background structure.",
          "transferable": false
        }
      ],
      "sources": [
        "P0289"
      ]
    },
    {
      "id": "Q000006",
      "title": "Magnetism as Initial Distinction?",
      "domains": [
        "physics"
      ],
      "summary": "Proposes a magnetism analogy to distinction.",
      "status": "open",
      "leak_profile": {
        "L1": 0.4,
        "L2": 0.3,
        "L3": 0.6,
        "L4": 0.5,
        "L5": 0.2,
        "L6": 0.2
      },
      "chart_tags": [
        "physics",
        "measurement",
        "constraint",
        "computation"
      ],
      "claim_temptations": [
        "I"
      ],
      "invariants": [
        {
          "id": "I-006-001",
          "name": "Orientation residue",
          "definition": "Closed transport leaves a stable orientation residue. (discriminator)",
          "role": "regime_marker"
        }
      ],
      "discriminators": [
        {
          "id": "D-PHY-003",
          "name": "Orientation flip residue",
          "pattern": "interface_scatter",
          "how_to": "Observable: orientation residue after closed transport with polarity flips. Split criterion: keep when orientation residue survives closure; reject when residue disappears under relabeling. Orthogonality note: this test isolates orientation/parity structure rather than generic gauge-equivalence filtering.",
          "transferable": true
        }
      ],
      "sources": [
        "P0294"
      ],
      "interface_variables": [
        "orientation residue"
      ]
    },
    {
      "id": "Q000007",
      "title": "Entry Point Leaks and Actionability Request",
      "domains": [
        "logic",
        "epistemology"
      ],
      "summary": "Asks for actionable leak analysis.",
      "status": "open",
      "leak_profile": {
        "L1": 0.2,
        "L2": 0.2,
        "L3": 0.2,
        "L4": 0.3,
        "L5": 0.7,
        "L6": 0.5
      },
      "chart_tags": [
        "method",
        "logic",
        "epistemology",
        "computation"
      ],
      "claim_temptations": [
        "I"
      ],
      "invariants": [
        {
          "id": "I-007-001",
          "name": "Seam visibility",
          "definition": "Typed seams remain explicit under entry framing shifts. (glue_key)",
          "role": "regime_marker"
        }
      ],
      "discriminators": [
        {
          "id": "D-CI-002",
          "name": "Chart leakage split",
          "pattern": "orthogonal_probe",
          "how_to": "Observable: typed seam count under ontic-entry vs epistemic-entry framing. Split criterion: pass only when seam types remain visible and consistently typed across entry framings; fail when framing shifts mask seams or collapse distinct seam types into one label.",
          "transferable": true
        }
      ],
      "sources": [
        "P0338"
      ],
      "interface_variables": [
        "ledger stability / taxonomy drift",